{
  "id": "01J00000000000000000000S01",
  "name": "nightly-research",
  "cron": "0 3 * * *",
  "persona_id": "01J00000000000000000000P01",
  "action": { "kind": "loop", "definition_name": "research" },
  "status": "enabled",
  "last_run_at": null,
  "next_run_at": "2026-07-29T03:00:00Z",
  "created_at": "2026-07-28T12:00:00Z",
  "updated_at": "2026-07-28T12:00:00Z"
}
